{
  "$schema": "https://json-schema.org/draft/2020-12/schema",
  "$id": "sentra.priority.v1",
  "title": "Sentra Priority",
  "type": "object",
  "required": ["id", "rank", "title", "why", "desiredOutcome"],
  "properties": {
    "id": { "type": "string", "minLength": 1 },
    "rank": { "type": "integer", "minimum": 1 },
    "title": { "type": "string", "minLength": 1 },
    "why": { "type": "string", "minLength": 1 },
    "desiredOutcome": { "type": "string", "minLength": 1 }
  },
  "additionalProperties": true
}
