[
  {
    "id": "agentic-workflow-run-closeout",
    "rank": 1,
    "title": "Hermes Agentic Workflow Run Closeout",
    "why": "Multi-project prioritization selected Hermes Agentic Workflow as the top project, but its run-v4 PR lifecycle has been tracking-ready with no branch, push, or PR across multiple cycles, and no closeout artifact has been produced.",
    "desiredOutcome": "Produce the proposed post-merge ledger (or an explicit closeout decision) for run-v4 so the top-priority project stops stalling."
  }
]
